{
  "schemaVersion": 1,
  "name": "finance-tracker",
  "owner": "yejianqin61-cell",
  "repo": "yejianqin61-cell/finance-tracker",
  "description": "Track expenses, income, manage categories, and analyze your financial aspects with an interactive dashboard.",
  "createdAt": "2026-07-10T03:35:22.975Z"
}
